{
  "task_id": "TASK-2026-0001-bootstrap",
  "invariant_set": [
    {
      "id": "INV-1",
      "text": "AI-First: JSON primary, markdown derivative",
      "verification": "All knowledge files exist as JSON; markdown is auto-generated derivative"
    },
    {
      "id": "INV-2",
      "text": "Stack-Agnostic: system does not know language/framework",
      "verification": "No language-specific branching in extension code"
    },
    {
      "id": "INV-3",
      "text": "Legacy/Greenfield parity: onboarding works in empty and non-empty projects",
      "verification": "Onboarding pipeline handles clean, partial, foreign_system, mixed_system, compatible states"
    },
    {
      "id": "INV-4",
      "text": "Task-Centric accumulation: each task is an atom, knowledge inherits",
      "verification": "Every task has task.json; registry updated; closed tasks read by agents"
    },
    {
      "id": "INV-5",
      "text": "Operator layers: read-only TUI, docs-as-code",
      "verification": "TUI widgets do not allow code editing; docs generated from code"
    },
    {
      "id": "INV-6",
      "text": "Deterministic context: no implicit state",
      "verification": "Subagents use clean sessions; context assembled from explicit files"
    },
    {
      "id": "INV-7",
      "text": "Pi-Native: extension, not standalone tool",
      "verification": "All code in .pi/extensions/loom/; single agent with different prompts per mode"
    },
    {
      "id": "INV-8",
      "text": "Git-based review: reviewer analyzes artifacts, not session",
      "verification": "Review artifact references git commit hash; reviewer analyzes git diff"
    },
    {
      "id": "INV-9",
      "text": "Executor does not write code: only orchestrates worker + reviewer",
      "verification": "Executor tools: spawn_worker, spawn_reviewer, update_task_status, read_artifact. NO write/edit/commit"
    },
    {
      "id": "INV-10",
      "text": "Models are configurable: no hardcode",
      "verification": "Model config in subagent-config.json; no hardcoded model strings in extension code"
    },
    {
      "id": "INV-11",
      "text": "Strictly sequential execution: step N -> worker -> reviewer -> step N+1",
      "verification": "Executor loop cannot spawn more than one worker simultaneously"
    },
    {
      "id": "INV-12",
      "text": "Localization: UI and user artifacts in Russian; AI documentation in English",
      "verification": "System prompts, JSON schemas, code comments in English; operator text in Russian; machine markers in English"
    },
    {
      "id": "INV-13",
      "text": "Git commit safety: staged list, not git add -A",
      "verification": "Worker commits only files listed in files-to-commit.json"
    },
    {
      "id": "INV-14",
      "text": "Pi CLI verified: all flags for subagent spawner confirmed by PoC",
      "verification": "PoC report confirms --mode json, --system-prompt, --model, --session-dir, --tools work. --system-prompt-file replaced by shell substitution."
    }
  ],
  "components": [
    {
      "id": "COMP-orchestrator",
      "name": "Orchestrator (Plan Mode)",
      "responsibilities": ["Formulate task", "Brainstorm with operator", "Create artifacts (task/plan/sdd)", "Spawn scout/researcher/architect subagents"],
      "interfaces": ["create_task tool", "create_plan tool", "spawn_subagent tool", "finalize_plan tool"],
      "dependencies": ["COMP-knowledge-io", "COMP-spawner"],
      "files": [".pi/extensions/loom/plan-mode/orchestrator.ts", ".pi/extensions/loom/plan-mode/tools.ts"],
      "status": "verified"
    },
    {
      "id": "COMP-executor",
      "name": "Executor (Agent Mode)",
      "responsibilities": ["Execute plan step by step", "Spawn worker and reviewer", "Make approve/reject/escalate decisions", "Update task status"],
      "interfaces": ["get_next_step tool", "spawn_worker tool", "spawn_reviewer tool", "check_iteration tool", "update_task_status tool", "read_artifact tool"],
      "dependencies": ["COMP-spawner", "COMP-knowledge-io"],
      "files": [".pi/extensions/loom/agent-mode/executor.ts", ".pi/extensions/loom/agent-mode/executor-loop.ts", ".pi/extensions/loom/agent-mode/tools.ts"],
      "status": "verified"
    },
    {
      "id": "COMP-spawner",
      "name": "Subagent Spawner",
      "responsibilities": ["Launch pi via child_process.spawn with --mode json --no-context-files", "Resolve model via domain_rules from subagent-config.json", "Monitor progress via stdout JSON streaming"],
      "interfaces": ["child_process.spawn API", "pi CLI flags: --mode json, --append-system-prompt, --model, --tools, --no-context-files", "resolveModelArg() for domain-aware model selection"],
      "dependencies": ["pi CLI"],
      "files": [".pi/extensions/loom/subagent/spawner.ts", ".pi/extensions/loom/subagent/progress.ts", ".pi/extensions/loom/subagent/model-resolver.ts"],
      "status": "verified"
    },
    {
      "id": "COMP-knowledge-io",
      "name": "Knowledge I/O",
      "responsibilities": ["JSON read/write", "Markdown generation", "Schema validation"],
      "interfaces": ["read_json", "write_json", "generate_markdown", "validate_schema"],
      "dependencies": [],
      "files": [".pi/extensions/loom/knowledge/io.ts", ".pi/extensions/loom/knowledge/schemas.ts", ".pi/extensions/loom/knowledge/onboarding.ts"],
      "status": "verified"
    },
    {
      "id": "COMP-worker",
      "name": "Worker Subagent",
      "responsibilities": ["Execute one plan step", "Write code/docs/configs", "Make task-scoped git commit", "Write summary.json and audit.json"],
      "interfaces": ["read", "bash", "write", "edit", "git commit", "summary.json", "audit.json"],
      "dependencies": ["COMP-spawner"],
      "files": [".pi/extensions/loom/subagent/prompts/worker.md"],
      "status": "verified"
    },
    {
      "id": "COMP-reviewer",
      "name": "Reviewer Subagent",
      "responsibilities": ["Check worker result against invariants and rules", "Analyze git diff", "Write review.json"],
      "interfaces": ["git show", "read", "write review.json"],
      "dependencies": ["COMP-spawner"],
      "files": [".pi/extensions/loom/subagent/prompts/reviewer.md"],
      "status": "verified"
    },
    {
      "id": "COMP-onboarding",
      "name": "Onboarding Pipeline",
      "responsibilities": ["Pre-check project state", "Classify as clean/partial/foreign/mixed/compatible", "Initialize knowledge structure", "Generate AGENTS.md", "Run onboarding wizard"],
      "interfaces": ["/loom-init command", "onboardProject()", "generateAgentsMd()", "preCheck()", "ensureKnowledgeStructure()"],
      "dependencies": ["COMP-knowledge-io", "COMP-scout", "COMP-researcher", "COMP-migrator"],
      "files": [".pi/extensions/loom/knowledge/onboarding.ts"],
      "status": "verified"
    },
    {
      "id": "COMP-scout",
      "name": "Scout Subagent",
      "responsibilities": ["Analyze codebase by file extensions and config files", "Produce stack.json with technology stack and module map"],
      "interfaces": ["loom_run_scout tool", "scout.md prompt", "stack.json artifact"],
      "dependencies": ["COMP-spawner"],
      "files": [".pi/extensions/loom/subagent/prompts/scout.md", ".pi/extensions/loom/subagent/specs.ts"],
      "status": "verified"
    },
    {
      "id": "COMP-researcher",
      "name": "Research Subagent",
      "responsibilities": ["Analyze project documentation, CI/CD, conventions", "Produce context-research.json"],
      "interfaces": ["loom_run_researcher tool", "researcher.md prompt", "context-research.json artifact"],
      "dependencies": ["COMP-spawner"],
      "files": [".pi/extensions/loom/subagent/prompts/researcher.md", ".pi/extensions/loom/subagent/specs.ts"],
      "status": "verified"
    },
    {
      "id": "COMP-migrator",
      "name": "Migration Subagent",
      "responsibilities": ["Detect foreign task/knowledge systems", "Analyze migration feasibility", "Produce migration-analysis.json"],
      "interfaces": ["loom_run_migrator tool", "migrator.md prompt", "migration-analysis.json artifact"],
      "dependencies": ["COMP-spawner"],
      "files": [".pi/extensions/loom/subagent/prompts/migrator.md", ".pi/extensions/loom/subagent/specs.ts"],
      "status": "verified"
    },
    {
      "id": "COMP-catalogs",
      "name": "Rules + Architecture Catalogs",
      "responsibilities": ["Store and manage project rules", "Store and manage architecture components", "Provide list/add operations"],
      "interfaces": ["/rule-add, /rule-list commands", "/arch-add, /arch-list commands", "loom_add_rule, loom_list_rules tools", "loom_add_architecture_component, loom_list_architecture_components tools"],
      "dependencies": ["COMP-knowledge-io"],
      "files": [".pi/extensions/loom/plan-mode/tools.ts", ".pi/extensions/loom/knowledge/onboarding.ts"],
      "status": "verified"
    },
    {
      "id": "COMP-mode-switcher",
      "name": "Mode Switcher",
      "responsibilities": ["Switch between idle/plan/agent modes", "Provide keyboard shortcut ctrl+shift+m", "Persist and restore mode across sessions"],
      "interfaces": ["/plan command", "/agent command", "ctrl+shift+m shortcut", "enterPlanMode(), enterAgentMode(), enterIdleMode() helpers"],
      "dependencies": ["COMP-orchestrator", "COMP-executor"],
      "files": [".pi/extensions/loom/index.ts"],
      "status": "verified"
    }
  ],
  "data_model_refs": [
    "knowledge/project/schemas/task.schema.json",
    "knowledge/project/schemas/plan.schema.json",
    "knowledge/project/schemas/sdd.schema.json",
    "knowledge/project/schemas/review.schema.json",
    "knowledge/project/schemas/rule.schema.json",
    "knowledge/project/schemas/architecture-component.schema.json",
    "knowledge/project/schemas/subagent-spec.schema.json",
    "knowledge/project/schemas/error.schema.json",
    "knowledge/project/configs/execution-config.json",
    "knowledge/project/configs/subagent-config.json"
  ],
  "flows": [
    {